{
  "schema_version": "0.2",
  "session_id": "mig-20260601-a1b2c3",
  "request_id": "req-runtime-mvp-v0",
  "created_at": "2026-06-01T14:00:00.000Z",
  "updated_at": "2026-06-01T16:24:16.093Z",
  "status": "complete",
  "stage": "draft_complete",
  "phase": "pack",
  "runtime_profile": "groundtruth_run",
  "operator_id": "op-runtime-verify",
  "request_type": "groundtruth_run",
  "capture_profile": {
    "multi_query": false,
    "website_pass": true,
    "landing_pass": true,
    "keyword_pass": false,
    "deep_research_pass": false
  },
  "scope": {
    "niche": "manipulator rental",
    "region": "Krasnodar Krai",
    "city": "Krasnodar",
    "business_type": "local_service",
    "search_engine": "yandex",
    "device": "mobile"
  },
  "queries": {
    "seed_queries": [
      "аренда манипулятора Краснодар"
    ],
    "query_used": "аренда манипулятора Краснодар",
    "query_set": [],
    "queries_executed": []
  },
  "serp": {
    "mode": "manual",
    "captured_at": "2026-06-01T10:00:00.000Z",
    "result_file": "serp_result.json",
    "discovery_mode": "single"
  },
  "competitor_discovery": {
    "status": "complete",
    "competitor_count": 4,
    "discovery_mode": "single",
    "query_coverage": "complete",
    "generated_at": "2026-06-01T16:24:16.060Z",
    "artifact_file": "competitors.json",
    "discovery_pass_at": "2026-06-01T16:24:16.060Z"
  },
  "website_acquisition": {
    "status": "complete",
    "snapshots_planned": 2,
    "snapshots_success": 2,
    "artifact_file": "website_snapshots.json"
  },
  "landing_analysis": {
    "status": "complete",
    "landings_analyzed": 2,
    "artifact_file": "landing_observations.json"
  },
  "keyword_intelligence": {
    "status": "skipped",
    "artifact_file": "keyword_registry.json"
  },
  "deep_research": {
    "status": "skipped",
    "artifact_file": "research_findings.json"
  },
  "pack": {
    "pack_state": "draft",
    "mig_phase": "3",
    "draft_file": "research_pack.draft.md",
    "approved_file": null,
    "approved_by": null,
    "approved_at": null,
    "published_at": null,
    "consumed_at": null
  },
  "artifacts": {
    "session_manifest": "session_manifest.json",
    "serp_result": "serp_result.json",
    "serp_index": null,
    "competitors": "competitors.json",
    "website_snapshots": "website_snapshots.json",
    "landing_observations": "landing_observations.json",
    "keyword_registry": null,
    "research_findings": null,
    "research_pack_draft": "research_pack.draft.md"
  },
  "coverage": {
    "session_grade": "C",
    "phases_completed": [
      "intake",
      "search",
      "competitors",
      "websites",
      "landings"
    ],
    "phases_skipped": [
      "keywords",
      "deep_research"
    ],
    "phases_failed": [],
    "partial": false
  },
  "errors": [],
  "safe_unknown": [
    "exact ad positions not verified",
    "Website capture partial: 2 competitor(s) skipped (see url_plan)"
  ],
  "runtime_metadata": {
    "spine_version": "0.2",
    "orchestrator": "mig_runtime_mvp",
    "last_pass": "pack",
    "n8n_execution_id": null
  },
  "pass_status": {
    "intake": "complete",
    "search": "complete",
    "competitors": "complete",
    "websites": "complete",
    "landings": "complete",
    "keywords": "skipped",
    "deep_research": "skipped",
    "pack": "complete"
  },
  "approval": {
    "pack_state": "draft",
    "approved_by": null,
    "approved_at": null
  },
  "mig_phase": "2"
}
